[
  {
    "ts": "2026-10-17T14:00:00Z",
    "provider": "dalle",
    "model": "dall-e-3",
    "kind": "image",
    "prompt_text": "a watercolor fox in a puddle",
    "response_text": "ok",
    "regenerated": false
  },
  {
    "ts": "2026-10-17T11:00:00Z",
    "provider": "chatgpt",
    "model": "gpt-4o-mini",
    "kind": "text",
    "prompt_text": "who's the mayor of Boston",
    "response_text": "ok",
    "regenerated": false
  },
  {
    "ts": "2026-10-17T08:00:00Z",
    "provider": "claude",
    "model": "claude-opus",
    "kind": "text",
    "prompt_text": "weather in Tokyo",
    "response_text": "ok",
    "regenerated": false
  },
  {
    "ts": "2026-10-17T05:00:00Z",
    "provider": "claude",
    "model": "claude-haiku",
    "kind": "text",
    "prompt_text": "Write a CUDA kernel for fused attention with flash-attention v3 constraints",
    "response_text": "ok",
    "regenerated": false
  },
  {
    "ts": "2026-10-17T02:00:00Z",
    "provider": "gemini",
    "model": "gemini-pro",
    "kind": "text",
    "prompt_text": "translate hello to French",
    "response_text": "ok",
    "regenerated": false
  },
  {
    "ts": "2026-10-16T23:00:00Z",
    "provider": "gemini",
    "model": "gemini-flash",
    "kind": "text",
    "prompt_text": "summarize this paragraph briefly",
    "response_text": "ok",
    "regenerated": true
  },
  {
    "ts": "2026-10-16T20:00:00Z",
    "provider": "grok",
    "model": "grok-3",
    "kind": "text",
    "prompt_text": "Prove the amortized complexity of this splay tree rotation sequence",
    "response_text": "ok",
    "regenerated": false
  },
  {
    "ts": "2026-10-16T17:00:00Z",
    "provider": "perplexity",
    "model": "sonar-pro",
    "kind": "text",
    "prompt_text": "who's the mayor of Boston",
    "response_text": "ok",
    "regenerated": false
  },
  {
    "ts": "2026-10-16T14:00:00Z",
    "provider": "chatgpt",
    "model": "gpt-5",
    "kind": "text",
    "prompt_text": "weather in Tokyo",
    "response_text": "ok",
    "regenerated": false
  },
  {
    "ts": "2026-10-16T11:00:00Z",
    "provider": "chatgpt",
    "model": "gpt-4o-mini",
    "kind": "text",
    "prompt_text": "Design a distributed consensus protocol for multi-region KV stores",
    "response_text": "ok",
    "regenerated": false
  },
  {
    "ts": "2026-10-16T08:00:00Z",
    "provider": "claude",
    "model": "claude-opus",
    "kind": "text",
    "prompt_text": "translate hello to French",
    "response_text": "ok",
    "regenerated": true
  },
  {
    "ts": "2026-10-16T05:00:00Z",
    "provider": "dalle",
    "model": "dall-e-3",
    "kind": "image",
    "prompt_text": "a watercolor fox in a puddle",
    "response_text": "ok",
    "regenerated": false
  },
  {
    "ts": "2026-10-16T02:00:00Z",
    "provider": "gemini",
    "model": "gemini-pro",
    "kind": "text",
    "prompt_text": "Refactor this React concurrent rendering pipeline for suspense boundaries",
    "response_text": "ok",
    "regenerated": false
  },
  {
    "ts": "2026-10-15T23:00:00Z",
    "provider": "gemini",
    "model": "gemini-flash",
    "kind": "text",
    "prompt_text": "who's the mayor of Boston",
    "response_text": "ok",
    "regenerated": false
  },
  {
    "ts": "2026-10-15T20:00:00Z",
    "provider": "grok",
    "model": "grok-3",
    "kind": "text",
    "prompt_text": "weather in Tokyo",
    "response_text": "ok",
    "regenerated": false
  },
  {
    "ts": "2026-10-15T17:00:00Z",
    "provider": "perplexity",
    "model": "sonar-pro",
    "kind": "text",
    "prompt_text": "define entropy",
    "response_text": "ok",
    "regenerated": true
  },
  {
    "ts": "2026-10-15T14:00:00Z",
    "provider": "chatgpt",
    "model": "gpt-5",
    "kind": "text",
    "prompt_text": "translate hello to French",
    "response_text": "ok",
    "regenerated": false
  },
  {
    "ts": "2026-10-15T11:00:00Z",
    "provider": "chatgpt",
    "model": "video-gen",
    "kind": "video",
    "prompt_text": "cinematic drone shot of a harbor",
    "response_text": "ok",
    "regenerated": false
  },
  {
    "ts": "2026-10-15T08:00:00Z",
    "provider": "claude",
    "model": "claude-opus",
    "kind": "text",
    "prompt_text": "Prove the amortized complexity of this splay tree rotation sequence",
    "response_text": "ok",
    "regenerated": false
  },
  {
    "ts": "2026-10-15T05:00:00Z",
    "provider": "claude",
    "model": "claude-haiku",
    "kind": "text",
    "prompt_text": "who's the mayor of Boston",
    "response_text": "ok",
    "regenerated": false
  },
  {
    "ts": "2026-10-15T02:00:00Z",
    "provider": "gemini",
    "model": "gemini-pro",
    "kind": "text",
    "prompt_text": "weather in Tokyo",
    "response_text": "ok",
    "regenerated": true
  },
  {
    "ts": "2026-10-14T23:00:00Z",
    "provider": "gemini",
    "model": "gemini-flash",
    "kind": "text",
    "prompt_text": "Design a distributed consensus protocol for multi-region KV stores",
    "response_text": "ok",
    "regenerated": false
  },
  {
    "ts": "2026-10-14T20:00:00Z",
    "provider": "dalle",
    "model": "dall-e-3",
    "kind": "image",
    "prompt_text": "a watercolor fox in a puddle",
    "response_text": "ok",
    "regenerated": false
  },
  {
    "ts": "2026-10-14T17:00:00Z",
    "provider": "perplexity",
    "model": "sonar-pro",
    "kind": "text",
    "prompt_text": "summarize this paragraph briefly",
    "response_text": "ok",
    "regenerated": false
  },
  {
    "ts": "2026-10-14T14:00:00Z",
    "provider": "chatgpt",
    "model": "gpt-5",
    "kind": "text",
    "prompt_text": "Refactor this React concurrent rendering pipeline for suspense boundaries",
    "response_text": "ok",
    "regenerated": false
  },
  {
    "ts": "2026-10-14T11:00:00Z",
    "provider": "chatgpt",
    "model": "gpt-4o-mini",
    "kind": "text",
    "prompt_text": "who's the mayor of Boston",
    "response_text": "ok",
    "regenerated": true
  },
  {
    "ts": "2026-10-14T08:00:00Z",
    "provider": "claude",
    "model": "claude-opus",
    "kind": "text",
    "prompt_text": "weather in Tokyo",
    "response_text": "ok",
    "regenerated": false
  },
  {
    "ts": "2026-10-14T05:00:00Z",
    "provider": "claude",
    "model": "claude-haiku",
    "kind": "text",
    "prompt_text": "Write a CUDA kernel for fused attention with flash-attention v3 constraints",
    "response_text": "ok",
    "regenerated": false
  },
  {
    "ts": "2026-10-14T02:00:00Z",
    "provider": "gemini",
    "model": "gemini-pro",
    "kind": "text",
    "prompt_text": "translate hello to French",
    "response_text": "ok",
    "regenerated": false
  },
  {
    "ts": "2026-10-13T23:00:00Z",
    "provider": "gemini",
    "model": "gemini-flash",
    "kind": "text",
    "prompt_text": "summarize this paragraph briefly",
    "response_text": "ok",
    "regenerated": false
  },
  {
    "ts": "2026-10-13T20:00:00Z",
    "provider": "grok",
    "model": "grok-3",
    "kind": "text",
    "prompt_text": "what is photosynthesis",
    "response_text": "ok",
    "regenerated": true
  },
  {
    "ts": "2026-10-13T17:00:00Z",
    "provider": "perplexity",
    "model": "sonar-pro",
    "kind": "text",
    "prompt_text": "who's the mayor of Boston",
    "response_text": "ok",
    "regenerated": false
  },
  {
    "ts": "2026-10-13T14:00:00Z",
    "provider": "chatgpt",
    "model": "gpt-5",
    "kind": "text",
    "prompt_text": "weather in Tokyo",
    "response_text": "ok",
    "regenerated": false
  },
  {
    "ts": "2026-10-13T11:00:00Z",
    "provider": "dalle",
    "model": "dall-e-3",
    "kind": "image",
    "prompt_text": "a watercolor fox in a puddle",
    "response_text": "ok",
    "regenerated": false
  },
  {
    "ts": "2026-10-13T08:00:00Z",
    "provider": "chatgpt",
    "model": "video-gen",
    "kind": "video",
    "prompt_text": "cinematic drone shot of a harbor",
    "response_text": "ok",
    "regenerated": false
  },
  {
    "ts": "2026-10-13T05:00:00Z",
    "provider": "claude",
    "model": "claude-haiku",
    "kind": "text",
    "prompt_text": "summarize this paragraph briefly",
    "response_text": "ok",
    "regenerated": true
  },
  {
    "ts": "2026-10-13T02:00:00Z",
    "provider": "gemini",
    "model": "gemini-pro",
    "kind": "text",
    "prompt_text": "Refactor this React concurrent rendering pipeline for suspense boundaries",
    "response_text": "ok",
    "regenerated": false
  },
  {
    "ts": "2026-10-12T23:00:00Z",
    "provider": "gemini",
    "model": "gemini-flash",
    "kind": "text",
    "prompt_text": "who's the mayor of Boston",
    "response_text": "ok",
    "regenerated": false
  },
  {
    "ts": "2026-10-12T20:00:00Z",
    "provider": "grok",
    "model": "grok-3",
    "kind": "text",
    "prompt_text": "weather in Tokyo",
    "response_text": "ok",
    "regenerated": false
  },
  {
    "ts": "2026-10-12T17:00:00Z",
    "provider": "perplexity",
    "model": "sonar-pro",
    "kind": "text",
    "prompt_text": "Write a CUDA kernel for fused attention with flash-attention v3 constraints",
    "response_text": "ok",
    "regenerated": false
  },
  {
    "ts": "2026-10-11T14:00:00Z",
    "provider": "perplexity",
    "model": "sonar-pro",
    "kind": "text",
    "prompt_text": "Design a distributed consensus protocol for multi-region KV stores",
    "response_text": "ok",
    "regenerated": false
  },
  {
    "ts": "2026-10-11T11:00:00Z",
    "provider": "gemini",
    "model": "gemini-pro",
    "kind": "text",
    "prompt_text": "who's the mayor of Boston",
    "response_text": "ok",
    "regenerated": false
  },
  {
    "ts": "2026-10-11T08:00:00Z",
    "provider": "claude",
    "model": "claude-opus",
    "kind": "text",
    "prompt_text": "Prove the amortized complexity of this splay tree rotation sequence",
    "response_text": "ok",
    "regenerated": false
  },
  {
    "ts": "2026-10-10T14:00:00Z",
    "provider": "claude",
    "model": "claude-haiku",
    "kind": "text",
    "prompt_text": "who's the mayor of Boston",
    "response_text": "ok",